name,force,level,mechanic,equipment,primaryMuscles,secondaryMuscles,instructions,category,id,image1,image2
Wide-Grip Decline Barbell Pullover,pull,intermediate,compound,barbell,chest,"shoulders, triceps","'Lie down on a decline bench with both legs securely locked in position. Reach for the barbell behind the head using a pronated grip (palms facing out). Make sure to grab the barbell wider than shoulder width apart for this exercise. Slowly lift the barbell up from the floor by using your arms.', 'When positioned properly, your arms should be fully extended and perpendicular to the floor. This is the starting position.', 'Begin by moving the barbell back down in a semicircular motion as if you were going to place it on the floor, but instead, stop when the arms are parallel to the floor. Tip: Keep the arms fully extended at all times. The movement should only happen at the shoulder joint. Inhale as you perform this portion of the movement.', 'Now bring the barbell up while exhaling until you are back at the starting position. Remember to keep full control of the barbell at all times.', 'Repeat the movement for the prescribed amount of repetitions of your training program.', 'When finished with your set, slowly lower the barbell back down until it is level with your head and release it.'",strength,Wide-Grip_Decline_Barbell_Pullover,Wide-Grip_Decline_Barbell_Pullover/0.jpg,Wide-Grip_Decline_Barbell_Pullover/1.jpg
Wide Stance Barbell Squat,push,intermediate,compound,barbell,quadriceps,"calves, glutes, hamstrings, lower back","'This exercise is best performed inside a squat rack for safety purposes. To begin, first set the bar on a rack that best matches your height. Once the correct height is chosen and the bar is loaded, step under the bar and place the back of your shoulders (slightly below the neck) across it.', 'Hold on to the bar using both arms at each side and lift it off the rack by first pushing with your legs and at the same time straightening your torso.', 'Step away from the rack and position your legs using a wider-than-shoulder-width stance with the toes slightly pointed out. Keep your head up at all times as looking down will get you off balance, and also maintain a straight back. This will be your starting position.', 'Begin to slowly lower the bar by bending the knees as you maintain a straight posture with the head up. Continue down until the angle between the upper leg and the calves becomes slightly less than 90-degrees (which is the point in which the upper legs are below parallel to the floor). Inhale as you perform this portion of the movement. Tip: If you performed the exercise correctly, the front of the knees should make an imaginary straight line with the toes that is perpendicular to the front. If your knees are past that imaginary line (if they are past your toes) then you are placing undue stress on the knee and the exercise has been performed incorrectly.', 'Begin to raise the bar as you exhale by pushing the floor with the heel of your foot as you straighten the legs again and go back to the starting position.', 'Repeat for the recommended amount of repetitions.'",strength,Wide_Stance_Barbell_Squat,Wide_Stance_Barbell_Squat/0.jpg,Wide_Stance_Barbell_Squat/1.jpg
World's Greatest Stretch,static,intermediate,,,hamstrings,"calves, glutes, quadriceps","'This is a three-part stretch. Begin by lunging forward, with your front foot flat on the ground and on the toes of your back foot. With your knees bent, squat down until your knee is almost touching the ground. Keep your torso erect, and hold this position for 10-20 seconds.', 'Now, place the arm on the same side as your front leg on the ground, with the elbow next to the foot. Your other hand should be placed on the ground, parallel to your lead leg, to help support you during this portion of the stretch.', 'After 10-20 seconds, place your hands on either side of your front foot. Raise the toes of the front foot off of the ground, and straighten your leg. You may need to reposition your rear leg to do so. Hold for 10-20 seconds, and then repeat the entire sequence for the other side.'",stretching,Worlds_Greatest_Stretch,Worlds_Greatest_Stretch/0.jpg,Worlds_Greatest_Stretch/1.jpg
Zottman Preacher Curl,pull,intermediate,isolation,dumbbell,biceps,forearms,"'Grab a dumbbell in each hand and place your upper arms on top of the preacher bench or the incline bench. The dumbbells should be held at shoulder height and the elbows should be flexed. Hold the dumbbells with the palms of your hands facing down. This will be your starting position.', 'As you breathe in, slowly lower the dumbbells keeping the palms down until your upper arm is extended and your biceps are fully stretched.', 'Now rotate your wrists once you are at the bottom of the movement so that the palms of the hands are facing up.', 'As you exhale, use your biceps to curl the weights up until they are fully contracted and the dumbbells are at shoulder height. Again, remember that to ensure full contraction you need to bring that small finger higher than the thumb.', 'Squeeze the biceps hard for a second at the contracted position and rotate your wrists so that the palms are facing down again.', 'Repeat for the recommended amount of repetitions.'",strength,Zottman_Preacher_Curl,Zottman_Preacher_Curl/0.jpg,Zottman_Preacher_Curl/1.jpg
Alternating Renegade Row,pull,expert,compound,kettlebells,middle back,"abdominals, biceps, chest, lats, triceps","'Place two kettlebells on the floor about shoulder width apart. Position yourself on your toes and your hands as though you were doing a pushup, with the body straight and extended. Use the handles of the kettlebells to support your upper body. You may need to position your feet wide for support.', 'Push one kettlebell into the floor and row the other kettlebell, retracting the shoulder blade of the working side as you flex the elbow, pulling it to your side.', 'Then lower the kettlebell to the floor and begin the kettlebell in the opposite hand. Repeat for several reps.'",strength,Alternating_Renegade_Row,Alternating_Renegade_Row/0.jpg,Alternating_Renegade_Row/1.jpg
Atlas Stones,pull,expert,compound,other,lower back,"abdominals, adductors, biceps, calves, forearms, glutes, hamstrings, middle back, quadriceps, traps","'Begin with the atlas stone between your feet. Bend at the hips to wrap your arms vertically around the Atlas Stone, attempting to get your fingers underneath the stone. Many stones will have a small flat portion on the bottom, which will make the stone easier to hold.', 'Pulling the stone into your torso, drive through the back half of your feet to pull the stone from the ground.', 'As the stone passes the knees, lap it by sitting backward, pulling the stone on top of your thighs.', 'Sit low, getting the stone high onto your chest as you change your grip to reach over the stone. Stand, driving through with your hips. Close distance to the loading platform, and lean back, extending the hips to get the stone as high as possible.'",strongman,Atlas_Stones,Atlas_Stones/0.jpg,Atlas_Stones/1.jpg
Barbell Ab Rollout - On Knees,pull,expert,compound,barbell,abdominals,"lower back, shoulders","'Hold an Olympic barbell loaded with 5-10lbs on each side and kneel on the floor.', 'Now place the barbell on the floor in front of you so that you are on all your hands and knees (as in a kneeling push up position). This will be your starting position.', 'Slowly roll the barbell straight forward, stretching your body into a straight position. Tip: Go down as far as you can without touching the floor with your body. Breathe in during this portion of the movement.', 'After a second pause at the stretched position, start pulling yourself back to the starting position as you breathe out. Tip: Go slowly and keep your abs tight at all times.'",strength,Barbell_Ab_Rollout_-_On_Knees,Barbell_Ab_Rollout_-_On_Knees/0.jpg,Barbell_Ab_Rollout_-_On_Knees/1.jpg
Barbell Squat To A Bench,push,expert,compound,barbell,quadriceps,"calves, glutes, hamstrings, lower back","'This exercise is best performed inside a squat rack for safety purposes. To begin, first place a flat bench or a box behind you. The flat bench is used to teach you to set your hips back and to hit depth.', '', 'Then, set the bar on a rack that best matches your height. Once the correct height is chosen and the bar is loaded, step under the bar and place the back of your shoulders (slightly below the neck) across it.', 'Hold on to the bar using both arms at each side and lift it off the rack by first pushing with your legs and at the same time straightening your torso.', 'Step away from the rack and position your legs using a shoulder width medium stance with the toes slightly pointed out. Keep your head up at all times as looking down will get you off balance and also maintain a straight back. This will be your starting position. (Note: For the purposes of this discussion we will use the medium stance described above which targets overall development; however you can choose any of the three stances discussed in the foot stances section).', 'Begin to slowly lower the bar by bending the knees and sitting your hips back as you maintain a straight posture with the head up. Continue down until you slightly touch the bench behind you. Inhale as you perform this portion of the movement. Tip: If you performed the exercise correctly, the front of the knees should make an imaginary straight line with the toes that is perpendicular to the front. If your knees are past that imaginary line (if they are past your toes) then you are placing undue stress on the knee and the exercise has been performed incorrectly.', 'Begin to raise the bar as you exhale by pushing the floor with the heel of your foot as you straighten the legs and extend the hips to go back to the starting position.', 'Repeat for the recommended amount of repetitions.'",strength,Barbell_Squat_To_A_Bench,Barbell_Squat_To_A_Bench/0.jpg,Barbell_Squat_To_A_Bench/1.jpg
Behind Head Chest Stretch,static,expert,isolation,other,chest,shoulders,"'Sit upright on the floor with your partner behind you.', 'Place your hands behind your hand, and push your elbows back as far as you can. Your partner should hold your elbows. This will be your starting position.', 'Gently attempt to pull your elbows forward with your hands still behind your head for 10 or more seconds. Your partner should prevent your elbows from moving.', 'Now, relax your muscles and have your partner gently pull the elbows back as far as it comfortable for you. Be sure to let your partner know when the stretch is adequate to prevent overstretching or injury.'",stretching,Behind_Head_Chest_Stretch,Behind_Head_Chest_Stretch/0.jpg,Behind_Head_Chest_Stretch/1.jpg
Bench Press with Chains,push,expert,compound,barbell,triceps,"chest, lats, shoulders","'Adjust the leader chain, shortening it to the desired length.Place the chains on the sleeves of the bar.', 'Lying on the bench, get your head beyond the bar if possible. Tuck your feet underneath you and arch your back. Using the bar to help support your weight, lift your shoulder off the bench and retract them, squeezing the shoulder blades together. Use your feet to drive your traps into the bench. Maintain this tight body position throughout the movement. However wide your grip, it should cover the ring on the bar.', 'Pull the bar out of the rack without protracting your shoulders. Focus on squeezing the bar and trying to pull it apart. Lower the bar to your lower chest or upper stomach. The bar, wrist, and elbow should stay in line at all times.', 'Pause when the barbell touches your torso, and then drive the bar up with as much force as possible. The elbows should be tucked in until lockout.'",powerlifting,Bench_Press_with_Chains,Bench_Press_with_Chains/0.jpg,Bench_Press_with_Chains/1.jpg
Bent Press,pull,expert,compound,kettlebells,abdominals,"glutes, hamstrings, lower back, quadriceps, shoulders, triceps","'Clean a kettlebell to your shoulder. Clean the kettlebell to your shoulders by extending through the legs and hips as you raise the kettlebell towards your shoulder. The wrist should rotate as you do so. This will be your starting position.', 'Begin my leaning to the side opposite the kettlebell, continuing until you are able to touch the ground with your free hand, keeping your eyes on the kettlebell. As you do so, press the weight vertically be extending through the elbow, keeping your arm perpendicular to the ground.', 'Return to an upright position, with the kettlebell above your head. Return the kettlebell to the shoulder and repeat for the desired number of repetitions.'",strength,Bent_Press,Bent_Press/0.jpg,Bent_Press/1.jpg
Box Squat with Bands,push,expert,compound,barbell,quadriceps,"abductors, adductors, calves, glutes, hamstrings, lower back","Begin in a power rack with a box at the appropriate height behind you. Set up the bands on the sleeves, secured to either band pegs, the rack, or dumbbells so that there is appropriate tension. If dumbbells are used, secure them so that they don't move. Also, ensure that the dumbbells you are using are heavy enough for the bands that you are using. Additional plates can be used to hold the dumbbells down. If more tension is needed, you can either widen the base on the floor or choke the bands. Typically, you would aim for a box height that brings you to a parallel squat, but you can train higher or lower if desired., 'Begin by stepping under the bar and placing it across the back of the shoulders. Squeeze your shoulder blades together and rotate your elbows forward, attempting to bend the bar across your shoulders. Remove the bar from the rack, creating a tight arch in your lower back, and step back into position. Place your feet wider for more emphasis on the back, glutes, adductors, and hamstrings, or closer together for more quad development. Keep your head facing forward.', 'With your back, shoulders, and core tight, push your knees and butt out and you begin your descent. Sit back with your hips until you are seated on the box. Ideally, your shins should be perpendicular to the ground. Pause when you reach the box, and relax the hip flexors. Never bounce off of a box.', 'Keeping the weight on your heels and pushing your feet and knees out, drive upward off of the box as you lead the movement with your head. Continue upward, maintaining tightness head to toe. Use care to return the barbell to the rack.'",powerlifting,Box_Squat_with_Bands,Box_Squat_with_Bands/0.jpg,Box_Squat_with_Bands/1.jpg
Box Squat with Chains,push,expert,compound,barbell,quadriceps,"abductors, adductors, calves, glutes, hamstrings, lower back","'Begin in a power rack with a box at the appropriate height behind you. Typically, you would aim for a box height that brings you to a parallel squat, but you can train higher or lower if desired.', 'To set up the chains, begin by looping the leader chain over the sleeves of the bar. The heavy chain should be attached using a snap hook. Adjust the length of the lead chain so that a few links are still on the floor at the top of the movement.', 'Begin by stepping under the bar and placing it across the back of the shoulders. Squeeze your shoulder blades together and rotate your elbows forward, attempting to bend the bar across your shoulders. Remove the bar from the rack, creating a tight arch in your lower back, and step back into position. Place your feet wider for more emphasis on the back, glutes, adductors, and hamstrings, or closer together for more quad development. Keep your head facing forward.', 'With your back, shoulders, and core tight, push your knees and butt out and you begin your descent. Sit back with your hips until you are seated on the box. Ideally, your shins should be perpendicular to the ground. Pause when you reach the box, and relax the hip flexors. Never bounce off of a box.', 'Keeping the weight on your heels and pushing your feet and knees out, drive upward off of the box as you lead the movement with your head. Continue upward, maintaining tightness head to toe.'",strength,Box_Squat_with_Chains,Box_Squat_with_Chains/0.jpg,Box_Squat_with_Chains/1.jpg
Circus Bell,push,expert,compound,other,shoulders,"forearms, glutes, hamstrings, lower back, traps, triceps","'The circus bell is an oversized dumbbell with a thick handle. Begin with the dumbbell between your feet, and grip the handle with both hands.', 'Clean the dumbbell by extending through your hips and knees to deliver the implement to the desired shoulder, letting go with the extra hand.', 'Ensure that you get one of the dumbbell heads behind the shoulder to keep from being thrown off balance. To raise it overhead, dip by flexing the knees, and the drive upwards as you extend the dumbbell overhead, leaning slightly away from it as you do so.', 'Carefully guide the bell back to the floor, keeping it under control as much as possible. It is best to perform this event on a thick rubber mat to prevent damage to the floor.'",strongman,Circus_Bell,Circus_Bell/0.jpg,Circus_Bell/1.jpg
Clean and Jerk,push,expert,compound,barbell,shoulders,"abdominals, glutes, hamstrings, lower back, quadriceps, traps, triceps","'With a barbell on the floor close to the shins, take an overhand or hook grip just outside the legs. Lower your hips with the weight focused on the heels, back straight, head facing forward, chest up, with your shoulders just in front of the bar. This will be your starting position.', 'Begin the first pull by driving through the heels, extending your knees. Your back angle should stay the same, and your arms should remain straight. Move the weight with control as you continue to above the knees.', 'Next comes the second pull, the main source of acceleration for the clean. As the bar approaches the mid-thigh position, begin extending through the hips. In a jumping motion, accelerate by extending the hips, knees, and ankles, using speed to move the bar upward. There should be no need to actively pull through the arms to accelerate the weight; at the end of the second pull, the body should be fully extended, leaning slightly back, with the arms still extended.', 'As full extension is achieved, transition into the third pull by aggressively shrugging and flexing the arms with the elbows up and out. At peak extension, aggressively pull yourself down, rotating your elbows under the bar as you do so. Receive the bar in a front squat position, the depth of which is dependent upon the height of the bar at the end of the third pull. The bar should be racked onto the protracted shoulders, lightly touching the throat with the hands relaxed. Continue to descend to the bottom squat position, which will help in the recovery.', 'Immediately recover by driving through the heels, keeping the torso upright and elbows up. Continue until you have risen to a standing position.', 'The second phase is the jerk, which raises the weight overhead. Standing with the weight racked on the front of the shoulders, begin with the dip. With your feet directly under your hips, flex the knees without moving the hips backward. Go down only slightly, and reverse direction as powerfully as possible.', 'Drive through the heels create as much speed and force as possible, and be sure to move your head out of the way as the bar leaves the shoulders.', 'At this moment as the feet leave the floor, the feet must be placed into the receiving position as quickly as possible. In the brief moment the feet are not actively driving against the platform, the athletes effort to push the bar up will drive them down. The feet should be split, with one foot forward, and one foot back. Receive the bar with the arms locked out overhead. Return to a standing position.'",olympic weightlifting,Clean_and_Jerk,Clean_and_Jerk/0.jpg,Clean_and_Jerk/1.jpg
Deadlift with Bands,pull,expert,compound,barbell,lower back,"forearms, glutes, hamstrings, middle back, quadriceps, traps","'To deadlift with short bands, simply loop them over the bar before you start, and step into them to set up. For long bands, they will need to be anchored to a secure base, such as heavy dumbbells or a rack.', 'With your feet, and your grip set, take a big breath and then lower your hips and bend the knees until your shins contact the bar. Look forward with your head, keep your chest up and your back arched, and begin driving through the heels to move the weight upward. After the bar passes the knees, aggressively pull the bar back, pulling your shoulder blades together as you drive your hips forward into the bar.', 'Lower the bar by bending at the hips and guiding it to the floor.'",powerlifting,Deadlift_with_Bands,Deadlift_with_Bands/0.jpg,Deadlift_with_Bands/1.jpg
Deadlift with Chains,pull,expert,compound,barbell,lower back,"forearms, glutes, hamstrings, middle back, quadriceps, traps","'You can attach the chains to the sleeves of the bar, or just drape the middle over the bar so there is a greater weight increase as you lift.', 'Approach the bar so that it is centered over your feet. You feet should be about hip width apart. Bend at the hip to grip the bar at shoulder width, allowing your shoulder blades to protract. Typically, you would use an overhand grip or an over/under grip on heavier sets. With your feet, and your grip set, take a big breath and then lower your hips and bend the knees until your shins contact the bar.', 'Look forward with your head, keep your chest up and your back arched, and begin driving through the heels to move the weight upward. After the bar passes the knees, aggressively pull the bar back, pulling your shoulder blades together as you drive your hips forward into the bar.', 'Lower the bar by bending at the hips and guiding it to the floor.'",powerlifting,Deadlift_with_Chains,Deadlift_with_Chains/0.jpg,Deadlift_with_Chains/1.jpg
Double Kettlebell Snatch,pull,expert,compound,kettlebells,shoulders,"glutes, hamstrings, quadriceps","'Place two kettlebells behind your feet. Bend your knees and sit back to pick up the kettlebells.', 'Swing the kettlebells between your legs forcefully and reverse the direction.', 'Drive through with your hips and lock the ketttlebells overhead in one uninterrupted motion.'",strength,Double_Kettlebell_Snatch,Double_Kettlebell_Snatch/0.jpg,Double_Kettlebell_Snatch/1.jpg
Front Barbell Squat,push,expert,compound,barbell,quadriceps,"calves, glutes, hamstrings","'This exercise is best performed inside a squat rack for safety purposes. To begin, first set the bar on a rack that best matches your height. Once the correct height is chosen and the bar is loaded, bring your arms up under the bar while keeping the elbows high and the upper arm slightly above parallel to the floor. Rest the bar on top of the deltoids and cross your arms while grasping the bar for total control.', 'Lift the bar off the rack by first pushing with your legs and at the same time straightening your torso.', 'Step away from the rack and position your legs using a shoulder width medium stance with the toes slightly pointed out. Keep your head up at all times as looking down will get you off balance and also maintain a straight back. This will be your starting position. (Note: For the purposes of this discussion we will use the medium stance described above which targets overall development; however you can choose any of the three stances described in the foot positioning section).', 'Begin to slowly lower the bar by bending the knees as you maintain a straight posture with the head up. Continue down until the angle between the upper leg and the calves becomes slightly less than 90-degrees (which is the point in which the upper legs are below parallel to the floor). Inhale as you perform this portion of the movement. Tip: If you performed the exercise correctly, the front of the knees should make an imaginary straight line with the toes that is perpendicular to the front. If your knees are past that imaginary line (if they are past your toes) then you are placing undue stress on the knee and the exercise has been performed incorrectly.', 'Begin to raise the bar as you exhale by pushing the floor mainly with the middle of your foot as you straighten the legs again and go back to the starting position.', 'Repeat for the recommended amount of repetitions.'",strength,Front_Barbell_Squat,Front_Barbell_Squat/0.jpg,Front_Barbell_Squat/1.jpg
