name,force,level,mechanic,equipment,primaryMuscles,secondaryMuscles,instructions,category,id,image1,image2
Kettlebell Dead Clean,pull,intermediate,compound,kettlebells,hamstrings,"calves, glutes, lower back, quadriceps, traps","'Place kettlebell between your feet. To get in the starting position, push your butt back and look straight ahead.', 'Clean the kettlebell to your shoulder. Clean the kettlebell to your shoulders by extending through the legs and hips as you raise the kettlebell towards your shoulder. The wrist should rotate as you do so.', 'Lower the kettlebell, keeping the hamstrings loaded by keeping your back straight and your butt out.'",strength,Kettlebell_Dead_Clean,Kettlebell_Dead_Clean/0.jpg,Kettlebell_Dead_Clean/1.jpg
Kettlebell One-Legged Deadlift,pull,intermediate,compound,kettlebells,hamstrings,"glutes, lower back","'Hold a kettlebell by the handle in one hand. Stand on one leg, on the same side that you hold the kettlebell.', 'Keeping that knee slightly bent, perform a stiff legged deadlift by bending at the hip, extending your free leg behind you for balance.', 'Continue lowering the kettlebell until you are parallel to the ground, and then return to the upright position.'",strength,Kettlebell_One-Legged_Deadlift,Kettlebell_One-Legged_Deadlift/0.jpg,Kettlebell_One-Legged_Deadlift/1.jpg
Kettlebell Seesaw Press,push,intermediate,compound,kettlebells,shoulders,triceps,"'Clean two kettlebells two your shoulders.', 'Press one kettlebell.', 'Lower the kettlebell and immediately press the other kettlebell. Make sure to do the same amount of reps on both sides.'",strength,Kettlebell_Seesaw_Press,Kettlebell_Seesaw_Press/0.jpg,Kettlebell_Seesaw_Press/1.jpg
Kettlebell Turkish Get-Up (Lunge style),push,intermediate,compound,kettlebells,shoulders,"abdominals, hamstrings, quadriceps, triceps","'Lie on your back on the floor and press a kettlebell to the top position by extending the elbow. Bend the knee on the same side as the kettlebell.', 'Keeping the kettlebell locked out at all times, pivot to the opposite side and use your non- working arm to assist you in driving forward to the lunge position. Using your free hand, push yourself to a seated position, then progressing to one knee.', 'While looking up at the kettlebell, slowly stand up. Reverse the motion back to the starting position and repeat.'",strength,Kettlebell_Turkish_Get-Up_Lunge_style,Kettlebell_Turkish_Get-Up_Lunge_style/0.jpg,Kettlebell_Turkish_Get-Up_Lunge_style/1.jpg
Kipping Muscle Up,pull,intermediate,compound,other,lats,"abdominals, biceps, forearms, middle back, shoulders, traps, triceps","'Grip the rings using a false grip, with the base of your palms on top of the rings.', 'Begin with a movement swinging your legs backward slightly.', 'Counter that movement by swinging your legs forward and up, jerking your chin and chest back, pulling yourself up with both arms as you do so. As you reach the top position of the pull-up, pull the rings to your armpits as you roll your shoulders forward, allowing your elbows to move straight back behind you. This puts you into the proper position to continue into the dip portion of the movement.', 'Maintaining control and stability, extend through the elbow to complete the motion.', 'Use care when lowering yourself to the ground.'",strength,Kipping_Muscle_Up,Kipping_Muscle_Up/0.jpg,Kipping_Muscle_Up/1.jpg
Landmine Linear Jammer,push,intermediate,compound,barbell,shoulders,"abdominals, calves, chest, hamstrings, quadriceps, triceps","'Position a bar into landmine or, lacking one, securely anchor it in a corner. Load the bar to an appropriate weight and position the handle attachment on the bar.', 'Raise the bar from the floor, taking the handles to your shoulders. This will be your starting position.', 'In an athletic stance, squat by flexing your hips and setting your hips back, keeping your arms flexed.', 'Reverse the motion by powerfully extending through the hips, knees, and ankles, while also extending the elbows to straighten the arms. This movement should be done explosively, coming out of the squat to full extension as powerfully as possible.', 'Return to the starting position.'",strength,Landmine_Linear_Jammer,Landmine_Linear_Jammer/0.jpg,Landmine_Linear_Jammer/1.jpg
Log Lift,push,intermediate,compound,other,shoulders,"abdominals, chest, glutes, hamstrings, lower back, middle back, quadriceps, traps, triceps","'Begin standing with the log in front of you. Grasp the handles, and begin to clean the log. As you are bent over to start the clean, attempt to get the log as high as possible, pulling it into your chest. Extend through the hips and knees to bring it up to complete the clean.', 'Push your head back and look up, creating a shelf on your chest to rest the log. Begin the press by dipping, flexing slightly through the knees and reversing the motion. This push press will generate momentum to start the log moving vertically. Continue by extending through the elbows to press the log above your head. There are no strict rules on form, so use whatever techniques you are most efficient with. As the log is pressed, ensure that you push your head through on each repetition, looking forward.', 'Repeat as many times as possible. Attempt to control the descent of the log as it is returned to the ground.'",strongman,Log_Lift,Log_Lift/0.jpg,Log_Lift/1.jpg
Lunge Sprint,push,intermediate,compound,machine,quadriceps,"calves, glutes, hamstrings","'Adjust a bar in a Smith machine to an appropriate height. Position yourself under the bar, racking it across the back of your shoulders. Unrack the bar, and then split your feet, moving one foot forward and one foot back. This will be your starting position.', 'Lower your back knee nearly to the ground, flexing the knees and lowering your hips as you do so.', 'At the bottom of the descent, immediately reverse direction. Explosively drive through the heel of your front foot with light pressure from your back foot. Jump up and reverse the position of your legs.', 'Repeat for the recommended amount of repetitions.'",strength,Lunge_Sprint,Lunge_Sprint/0.jpg,Lunge_Sprint/1.jpg
Lying Close-Grip Barbell Triceps Press To Chin,push,intermediate,isolation,e-z curl bar,triceps,,"'While holding a barbell or EZ Curl bar with a pronated grip (palms facing forward), lie on your back on a flat bench with your head off the end of the bench. Tip: If you are holding a barbell grab it using a shoulder-width grip and if you are using an E-Z Bar grab it on the inner handles.', 'Extend your arms in front of you as you hold the barbell over your chest. The arms should be perpendicular to your torso (90-degree angle). This will be your starting position.', 'As you inhale, lower the bar in a semi-circular motion by bending at the elbows and while keeping the upper arm stationary and elbows in. Keep lowering the bar until it lightly touches your chin.', 'As you exhale bring the bar back up to the starting position by pushing the bar up in a semi-circular motion. Contract the triceps hard at the top of the movement for a second. Tip: Again, only the forearms should move. The upper arms should remain stationary at all times.', 'Repeat for the recommended amount of repetitions.'",strength,Lying_Close-Grip_Barbell_Triceps_Press_To_Chin,Lying_Close-Grip_Barbell_Triceps_Press_To_Chin/0.jpg,Lying_Close-Grip_Barbell_Triceps_Press_To_Chin/1.jpg
Lying Face Up Plate Neck Resistance,pull,intermediate,isolation,other,neck,,"'Lie face up with your whole body straight on a flat bench while holding a weight plate on top of your forehead. Tip: You will need to position yourself so that your shoulders are slightly above the end of a flat bench in order for the traps, neck and head to be off the bench. This will be your starting position.', 'While keeping the plate secure on your forehead slowly lower your head back in a semi-circular motion as you breathe in.', 'Raise your head back up to the starting position in a semi-circular motion as you breathe out. Hold the contraction for a second.', 'Repeat for the recommended amount of repetitions.'",strength,Lying_Face_Up_Plate_Neck_Resistance,Lying_Face_Up_Plate_Neck_Resistance/0.jpg,Lying_Face_Up_Plate_Neck_Resistance/1.jpg
Lying One-Arm Lateral Raise,pull,intermediate,isolation,dumbbell,shoulders,,"'While holding a dumbbell in one hand, lay with your chest down on a flat bench. The other hand can be used to hold to the leg of the bench for stability.', 'Position the palm of the hand that is holding the dumbbell in a neutral manner (palms facing your torso) as you keep the arm extended with the elbow slightly bent. This will be your starting position.', 'Now raise the arm with the dumbbell to the side until your elbow is at shoulder height and your arm is roughly parallel to the floor as you exhale. Tip: Maintain your arm perpendicular to the torso while keeping your arm extended throughout the movement. Also, keep the contraction at the top for a second.', 'Slowly lower the dumbbell to the starting position as you inhale.', 'Repeat for the recommended amount of repetitions.'",strength,Lying_One-Arm_Lateral_Raise,Lying_One-Arm_Lateral_Raise/0.jpg,Lying_One-Arm_Lateral_Raise/1.jpg
Lying Triceps Press,push,intermediate,isolation,e-z curl bar,triceps,,"'Lie on a flat bench with either an e-z bar (my preference) or a straight bar placed on the floor behind your head and your feet on the floor.', 'Grab the bar behind you, using a medium overhand (pronated) grip, and raise the bar in front of you at arms length. Tip: The arms should be perpendicular to the torso and the floor. The elbows should be tucked in. This is the starting position.', 'As you breathe in, slowly lower the weight until the bar lightly touches your forehead while keeping the upper arms and elbows stationary.', 'At that point, use the triceps to bring the weight back up to the starting position as you breathe out.', 'Repeat for the recommended amount of repetitions.'",strength,Lying_Triceps_Press,Lying_Triceps_Press/0.jpg,Lying_Triceps_Press/1.jpg
Muscle Up,pull,intermediate,compound,other,lats,"abdominals, biceps, forearms, middle back, shoulders, traps, triceps","'Grip the rings using a false grip, with the base of your palms on top of the rings. Initiate a pull up by pulling the elbows down to your side, flexing the elbows.', 'As you reach the top position of the pull-up, pull the rings to your armpits as you roll your shoulders forward, allowing your elbows to move straight back behind you. This puts you into the proper position to continue into the dip portion of the movement.', 'Maintaining control and stability, extend through the elbow to complete the motion.', 'Use care when lowering yourself to the ground.'",strength,Muscle_Up,Muscle_Up/0.jpg,Muscle_Up/1.jpg
Narrow Stance Squats,push,intermediate,compound,barbell,quadriceps,"calves, glutes, hamstrings, lower back","'This exercise is best performed inside a squat rack for safety purposes. To begin, first set the bar on a rack that best matches your height. Once the correct height is chosen and the bar is loaded, step under the bar and place the back of your shoulders (slightly below the neck) across it.', 'Hold on to the bar using both arms at each side and lift it off the rack by first pushing with your legs and at the same time straightening your torso.', 'Step away from the rack and position your legs using a less-than-shoulder-width narrow stance with the toes slightly pointed out. Feet should be around 3-6 inches apart. Keep your head up at all times (looking down will get you off balance) and maintain a straight back. This will be your starting position. (Note: For the purposes of this discussion we will use the medium stance described above which targets overall development; however you can choose any of the three stances discussed in the foot stances section).', 'Begin to slowly lower the bar by bending the knees as you maintain a straight posture with the head up. Continue down until the angle between the upper leg and the calves becomes slightly less than 90-degrees (which is the point in which the upper legs are below parallel to the floor). Inhale as you perform this portion of the movement. Tip: If you performed the exercise correctly, the front of the knees should make an imaginary straight line with the toes that is perpendicular to the front. If your knees are past that imaginary line (if they are past your toes) then you are placing undue stress on the knee and the exercise has been performed incorrectly.', 'Begin to raise the bar as you exhale by pushing the floor with the heel of your foot mainly as you straighten the legs again and go back to the starting position.', 'Repeat for the recommended amount of repetitions.'",strength,Narrow_Stance_Squats,Narrow_Stance_Squats/0.jpg,Narrow_Stance_Squats/1.jpg
Neck Press,push,intermediate,compound,barbell,chest,"shoulders, triceps","'Lie back on a flat bench. Using a medium-width grip (a grip that creates a 90-degree angle in the middle of the movement between the forearms and the upper arms), lift the bar from the rack and hold it straight over your neck with your arms locked. This will be your starting position.', 'As you breathe in, come down slowly until you feel the bar on your neck.', 'After a second pause, bring the bar back to the starting position as you breathe out and push the bar using your chest muscles. Lock your arms and squeeze your chest in the contracted position, hold for a second and then start coming down slowly again. Tip: It should take at least twice as long to go down than to come up).', 'Repeat the movement for the prescribed amount of repetitions.', 'When you are done, place the bar back in the rack.'",strength,Neck_Press,Neck_Press/0.jpg,Neck_Press/1.jpg
One-Arm Kettlebell Clean and Jerk,push,intermediate,compound,kettlebells,shoulders,,"'Hold a kettlebell by the handle.', 'Clean the kettlebell to your shoulder by extending through the legs and hips as you pull the kettlebell towards your shoulder. Rotate your wrist as you do so, so that the palm faces forward.', 'Dip your body by bending the knees, keeping your torso upright.', Immediately reverse direction, driving through the heels, in essence jumping to create momentum. As you do so, press the kettlebell overhead to lockout by extending the arms, using your body's momentum to move the weight., 'Receive the weight overhead by returning to a squat position underneath the weight.', 'Keeping the weight overhead, return to a standing position. Lower the weight to the floor to perform the next repetition.'",strength,One-Arm_Kettlebell_Clean_and_Jerk,One-Arm_Kettlebell_Clean_and_Jerk/0.jpg,One-Arm_Kettlebell_Clean_and_Jerk/1.jpg
One-Arm Kettlebell Military Press To The Side,push,intermediate,compound,kettlebells,shoulders,triceps,"'Clean a kettlebell to your shoulder. Clean the kettlebell to your shoulder by extending through the legs and hips as you pull the kettlebell towards your shoulder. Rotate your wrist as you do so, so that the palm faces inward. This will be your starting position.', 'Look at the kettlebell and press it up and out until it is locked out overhead.', 'Lower the kettlebell back to your shoulder under control and repeat. Make sure to contract your lat, butt, and stomach forcefully for added stability and strength.'",strength,One-Arm_Kettlebell_Military_Press_To_The_Side,One-Arm_Kettlebell_Military_Press_To_The_Side/0.jpg,One-Arm_Kettlebell_Military_Press_To_The_Side/1.jpg
One-Arm Kettlebell Row,pull,intermediate,compound,kettlebells,middle back,"biceps, lats","'Place a kettlebell in front of your feet. Bend your knees slightly and then push your butt out as much as possible as you bend over to get in the starting position. Grab the kettlebell and pull it to your stomach, retracting your shoulder blade and flexing the elbow. Keep your back straight. Lower and repeat.'",strength,One-Arm_Kettlebell_Row,One-Arm_Kettlebell_Row/0.jpg,One-Arm_Kettlebell_Row/1.jpg
One-Arm Open Palm Kettlebell Clean,pull,intermediate,compound,kettlebells,hamstrings,"forearms, glutes, lower back, quadriceps, shoulders","'Place one kettlebell between your feet.', 'Grab the handle with one hand and raise the kettlebell rapidly, let it flip so that the ball of the kettlebell lands in the palm of your hand.', 'Throw the kettlebell out in front of you and catch the handle with one hand.', 'Take the kettlebell to the floor and repeat. Make sure to work both arms.'",strength,One-Arm_Open_Palm_Kettlebell_Clean,One-Arm_Open_Palm_Kettlebell_Clean/0.jpg,One-Arm_Open_Palm_Kettlebell_Clean/1.jpg
Overhead Cable Curl,pull,intermediate,isolation,cable,biceps,,"'To begin, set a weight that is comfortable on each side of the pulley machine. Note: Make sure that the amount of weight selected is the same on each side.', 'Now adjust the height of the pulleys on each side and make sure that they are positioned at a height higher than that of your shoulders.', 'Stand in the middle of both sides and use an underhand grip (palms facing towards the ceiling) to grab each handle. Your arms should be fully extended and parallel to the floor with your feet positioned shoulder width apart from each other. Your body should be evenly aligned the handles. This is the starting position.', 'While exhaling, slowly squeeze the biceps on each side until your forearms and biceps touch.', 'While inhaling, move your forearms back to the starting position. Note: Your entire body is stationary during this exercise except for the forearms.', 'Repeat for the recommended amount of repetitions prescribed in your program.'",strength,Overhead_Cable_Curl,Overhead_Cable_Curl/0.jpg,Overhead_Cable_Curl/1.jpg
Peroneals Stretch,static,intermediate,,other,calves,,"'In a seated position, loop a belt, rope, or band around one foot. This will be your starting position.', 'With the leg extended and the heel off of the ground, pull on the belt so that the foot is inverted, with the inside of the foot being pulled towards you. Hold for 10-20 seconds, and then switch sides.'",stretching,Peroneals_Stretch,Peroneals_Stretch/0.jpg,Peroneals_Stretch/1.jpg
Plate Pinch,static,intermediate,isolation,other,forearms,,"'Grab two wide-rimmed plates and put them together with the smooth sides facing outward', 'Use your fingers to grip the outside part of the plate and your thumb for the other side thus holding both plates together. This is the starting position.', 'Squeeze the plate with your fingers and thumb. Hold this position for as long as you can.', 'Repeat for the recommended amount of sets prescribed in your program.', 'Switch arms and repeat the movements.'",strength,Plate_Pinch,Plate_Pinch/0.jpg,Plate_Pinch/1.jpg
Power Clean,pull,intermediate,compound,barbell,hamstrings,"calves, forearms, glutes, lower back, middle back, quadriceps, shoulders, traps, triceps","'Stand with your feet slightly wider than shoulder width apart and toes pointing out slightly.', 'Squat down and grasp bar with a closed, pronated grip. Your hands should be slightly wider than shoulder width apart outside knees with elbows fully extended.', 'Place the bar about 1 inch in front of your shins and over the balls of your feet.', 'Your back should be flat or slightly arched, your chest held up and out and your shoulder blades should be retracted.', 'Keep your head in a neutral position (in line with vertebral column and not tilted or rotated) with your eyes focused straight ahead. Inhale during this phase.', 'Lift the bar from the floor by forcefully extending the hips and the knees as you exhale. Tip: The upper torso should maintain the same angle. Do not bend at the waist yet and do not let the hips rise before the shoulders (this would have the effect of pushing the glutes in the air and stretching the hamstrings.', 'Keep elbows fully extended with the head in a neutral position and the shoulders over the bar.', 'As the bar raises keep it as close to the shins as possible.', 'As the bar passes the knees, thrust your hips forward and slightly bend the knees to avoid locking them. Tip: At this point your thighs should be against the bar.', 'Keep the back flat or slightly arched, elbows fully extended and your head neutral. Tip: You will hold your breath until the next phase.', 'Inhale and then forcefully and quickly extend your hips and knees and stand on your toes.', 'Keep the bar as close to your body as possible. Tip: Your back should be flat with the elbows pointed out to the sides and your head in a neutral position. Also, keep your shoulders over the bar and arms straight as long as possible.', 'When your lower body joints are fully extended, shrug the shoulders upward rapidly without letting the elbows flex yet. Exhale during this portion of the movement.', 'As the shoulders reach their highest elevation flex your elbows to begin pulling your body under the bar.', 'Continue to pull the arms as high and as long as possible. Tip: Due to the explosive nature of this phase, your torso will be erect or with an arched back, your head will be tilted back slightly and your feet may lose contact with the floor.', 'After the lower body has fully extended and the bar reaches near maximal height, pull your body under the bar and rotate the arms around and under the bar.', 'Simultaneously, flex the hips and knees into a quarter squat position.', 'Once the arms are under the bar, inhale and then lift your elbows to position the upper arms parallel to the floor. Rack the bar across the front of your collar bones and front shoulder muscles.', 'Catch the bar with an erect and tight torso, a neutral head position and flat feet. Exhale during this movement.', 'Stand up by extending the hips and knees to a fully erect position.', 'Lower the bar by gradually reducing the muscular tension of the arms to allow a controlled descent of the bar to the thighs. Inhale during this movement.', 'Simultaneously flex the hips and knees to cushion the impact of the bar on the thighs.', 'Squat down with the elbows fully extended until the bar touches the floor.', 'Start over at Phase 1 and repeat for the recommended amount of repetitions.'",strength,Power_Clean,Power_Clean/0.jpg,Power_Clean/1.jpg
Power Stairs,pull,intermediate,compound,other,hamstrings,"adductors, calves, glutes, lower back, quadriceps, shoulders, traps","'In the power stairs, implements are moved up a staircase. For training purposes, these can be performed with a tire or box.', 'Begin by taking the implement with both hands. Set your feet wide, with your head and chest up. Drive through the ground with your heels, extending your knees and hips to raise the weight from the ground.', 'As you lean back, attempt to swing the weight onto the stairs, which are usually around 16-18 high. You can use your legs to help push the weight onto the stair.', 'Repeat for 3-5 repetitions, and continue with a heavier weight, moving as fast as possible.'",strongman,Power_Stairs,Power_Stairs/0.jpg,Power_Stairs/1.jpg
Push Press - Behind the Neck,push,intermediate,compound,barbell,shoulders,"calves, quadriceps, triceps","'Standing with the weight racked on the back of the shoulders, begin with the dip. With your feet directly under your hips, flex the knees without moving the hips backward. Go down only slightly, and reverse direction as powerfully as possible. Drive through the heels create as much speed and force as possible, moving the bar in a vertical path.', 'Using the momentum generated, finish pressing the weight overhead be extending through the arms.', 'Return to the starting position, using your legs to absorb the impact.'",olympic weightlifting,Push_Press_-_Behind_the_Neck,Push_Press_-_Behind_the_Neck/0.jpg,Push_Press_-_Behind_the_Neck/1.jpg
Rack Delivery,pull,intermediate,compound,barbell,shoulders,"forearms, traps","'This drill teaches the delivery of the barbell to the rack position on the shoulders. Begin holding a bar in the scarecrow position, with the upper arms parallel to the floor, and the forearms hanging down. Use a hook grip, with your fingers wrapped over your thumbs.', 'Begin by rotating the elbows around the bar, delivering the bar to the shoulders. As your elbows come forward, relax your grip. The shoulders should be protracted, providing a shelf for the bar, which should lightly contact the throat.', 'It is important that the bar stay close to the body at all times, as with a heavier load any distance will result in an unwanted collision. As the movement becomes smoother, speed and load can be increased before progressing further.'",olympic weightlifting,Rack_Delivery,Rack_Delivery/0.jpg,Rack_Delivery/1.jpg
Reverse Band Bench Press,push,intermediate,compound,barbell,triceps,"chest, forearms, lats, middle back, shoulders","'Position a bench inside a power rack, with the bar set to the correct height. Begin by anchoring bands either to band pegs or to the top of the rack. Ensure that you will be position properly under the bands. Attach the other end to the barbell.', 'Lie on the bench, tuck your feet underneath you and arch your back. Using the bar to help support your weight, lift your shoulder off the bench and retract them, squeezing the shoulder blades together. Use your feet to drive your traps into the bench. Maintain this tight body position throughout the movement. However wide your grip, it should cover the ring on the bar.', 'Pull the bar out of the rack without protracting your shoulders. Focus on squeezing the bar and trying to pull it apart. Lower the bar to your lower chest or upper stomach. The bar, wrist, and elbow should stay in line at all times.', 'Pause when the barbell touches your torso, and then drive the bar up with as much force as possible. The elbows should be tucked in until lockout.'",powerlifting,Reverse_Band_Bench_Press,Reverse_Band_Bench_Press/0.jpg,Reverse_Band_Bench_Press/1.jpg
